{
  "contract_version": 3,
  "version": 3,
  "pricing_policy_version": 1,
  "category_catalog_version": 2,
  "size_catalog_version": 1,
  "inventory_policy_version": 1,
  "order_policy_version": 1,
  "model_colors_version": 1,
  "pim_version": "10.9.3",
  "currency": "UAH",
  "generated_at": "2026-10-09T12:00:00.000Z",
  "catalog_revision": "30f40655d823b0b4",
  "category_catalog_hash": "0058a062ebd411c2",
  "categories": [
    {
      "id": "clothing",
      "name": "Одяг та форма",
      "parent_id": null,
      "path": "Одяг та форма",
      "filter_schema": [
        "brand",
        "color",
        "camouflage",
        "material"
      ],
      "banner_asset": null,
      "banner_active": false,
      "banner_version": 0
    },
    {
      "id": "clothing_suits",
      "name": "Костюми та комплекти",
      "parent_id": "clothing",
      "path": "Одяг та форма / Костюми та комплекти",
      "filter_schema": [
        "brand",
        "color",
        "camouflage",
        "size",
        "season",
        "material",
        "membrane",
        "gender"
      ],
      "banner_asset": null,
      "banner_active": false,
      "banner_version": 0
    },
    {
      "id": "clothing_combat_shirts",
      "name": "Убакси та бойові сорочки",
      "parent_id": "clothing",
      "path": "Одяг та форма / Убакси та бойові сорочки",
      "filter_schema": [
        "brand",
        "color",
        "camouflage",
        "size",
        "season",
        "material",
        "membrane",
        "gender"
      ],
      "banner_asset": null,
      "banner_active": false,
      "banner_version": 0
    },
    {
      "id": "clothing_pants",
      "name": "Штани",
      "parent_id": "clothing",
      "path": "Одяг та форма / Штани",
      "filter_schema": [
        "brand",
        "color",
        "camouflage",
        "size",
        "season",
        "material",
        "membrane",
        "gender"
      ],
      "banner_asset": null,
      "banner_active": false,
      "banner_version": 0
    },
    {
      "id": "clothing_jackets",
      "name": "Куртки",
      "parent_id": "clothing",
      "path": "Одяг та форма / Куртки",
      "filter_schema": [
        "brand",
        "color",
        "camouflage",
        "size",
        "season",
        "material",
        "membrane",
        "gender"
      ],
      "banner_asset": null,
      "banner_active": false,
      "banner_version": 0
    },
    {
      "id": "clothing_fleece",
      "name": "Фліс та кофти",
      "parent_id": "clothing",
      "path": "Одяг та форма / Фліс та кофти",
      "filter_schema": [
        "brand",
        "color",
        "camouflage",
        "size",
        "season",
        "material",
        "membrane",
        "gender"
      ],
      "banner_asset": null,
      "banner_active": false,
      "banner_version": 0
    },
    {
      "id": "clothing_tshirts",
      "name": "Футболки та поло",
      "parent_id": "clothing",
      "path": "Одяг та форма / Футболки та поло",
      "filter_schema": [
        "brand",
        "color",
        "camouflage",
        "size",
        "season",
        "material",
        "membrane",
        "gender"
      ],
      "banner_asset": null,
      "banner_active": false,
      "banner_version": 0
    },
    {
      "id": "clothing_thermal",
      "name": "Термобілизна",
      "parent_id": "clothing",
      "path": "Одяг та форма / Термобілизна",
      "filter_schema": [
        "brand",
        "color",
        "camouflage",
        "size",
        "season",
        "material",
        "membrane",
        "gender"
      ],
      "banner_asset": null,
      "banner_active": false,
      "banner_version": 0
    },
    {
      "id": "clothing_shorts",
      "name": "Шорти",
      "parent_id": "clothing",
      "path": "Одяг та форма / Шорти",
      "filter_schema": [
        "brand",
        "color",
        "camouflage",
        "size",
        "season",
        "material",
        "membrane",
        "gender"
      ],
      "banner_asset": null,
      "banner_active": false,
      "banner_version": 0
    },
    {
      "id": "clothing_rainwear",
      "name": "Дощовики та пончо",
      "parent_id": "clothing",
      "path": "Одяг та форма / Дощовики та пончо",
      "filter_schema": [
        "brand",
        "color",
        "camouflage",
        "size",
        "season",
        "material",
        "membrane",
        "gender"
      ],
      "banner_asset": null,
      "banner_active": false,
      "banner_version": 0
    },
    {
      "id": "clothing_gloves",
      "name": "Рукавички",
      "parent_id": "clothing",
      "path": "Одяг та форма / Рукавички",
      "filter_schema": [
        "brand",
        "color",
        "camouflage",
        "size",
        "season",
        "material",
        "membrane",
        "gender"
      ],
      "banner_asset": null,
      "banner_active": false,
      "banner_version": 0
    },
    {
      "id": "clothing_headwear",
      "name": "Головні убори",
      "parent_id": "clothing",
      "path": "Одяг та форма / Головні убори",
      "filter_schema": [
        "brand",
        "color",
        "camouflage",
        "size",
        "season",
        "material",
        "membrane",
        "gender"
      ],
      "banner_asset": null,
      "banner_active": false,
      "banner_version": 0
    },
    {
      "id": "clothing_balaclavas",
      "name": "Балаклави та бафи",
      "parent_id": "clothing",
      "path": "Одяг та форма / Балаклави та бафи",
      "filter_schema": [
        "brand",
        "color",
        "camouflage",
        "size",
        "season",
        "material",
        "membrane",
        "gender"
      ],
      "banner_asset": null,
      "banner_active": false,
      "banner_version": 0
    },
    {
      "id": "clothing_belts",
      "name": "Ремені одягу",
      "parent_id": "clothing",
      "path": "Одяг та форма / Ремені одягу",
      "filter_schema": [
        "brand",
        "color",
        "camouflage",
        "size",
        "season",
        "material",
        "membrane",
        "gender"
      ],
      "banner_asset": null,
      "banner_active": false,
      "banner_version": 0
    },
    {
      "id": "footwear",
      "name": "Взуття",
      "parent_id": null,
      "path": "Взуття",
      "filter_schema": [
        "brand",
        "color",
        "camouflage",
        "material"
      ],
      "banner_asset": null,
      "banner_active": false,
      "banner_version": 0
    },
    {
      "id": "footwear_boots",
      "name": "Берці",
      "parent_id": "footwear",
      "path": "Взуття / Берці",
      "filter_schema": [
        "brand",
        "color",
        "camouflage",
        "size",
        "season",
        "material",
        "membrane",
        "gender"
      ],
      "banner_asset": null,
      "banner_active": false,
      "banner_version": 0
    },
    {
      "id": "footwear_tactical_boots",
      "name": "Тактичні черевики",
      "parent_id": "footwear",
      "path": "Взуття / Тактичні черевики",
      "filter_schema": [
        "brand",
        "color",
        "camouflage",
        "size",
        "season",
        "material",
        "membrane",
        "gender"
      ],
      "banner_asset": null,
      "banner_active": false,
      "banner_version": 0
    },
    {
      "id": "footwear_sneakers",
      "name": "Кросівки",
      "parent_id": "footwear",
      "path": "Взуття / Кросівки",
      "filter_schema": [
        "brand",
        "color",
        "camouflage",
        "size",
        "season",
        "material",
        "membrane",
        "gender"
      ],
      "banner_asset": null,
      "banner_active": false,
      "banner_version": 0
    },
    {
      "id": "footwear_socks",
      "name": "Шкарпетки",
      "parent_id": "footwear",
      "path": "Взуття / Шкарпетки",
      "filter_schema": [
        "brand",
        "color",
        "camouflage",
        "size",
        "season",
        "material",
        "membrane",
        "gender"
      ],
      "banner_asset": null,
      "banner_active": false,
      "banner_version": 0
    },
    {
      "id": "footwear_gaiters",
      "name": "Гамаші та бахіли",
      "parent_id": "footwear",
      "path": "Взуття / Гамаші та бахіли",
      "filter_schema": [
        "brand",
        "color",
        "camouflage",
        "size",
        "season",
        "material",
        "membrane",
        "gender"
      ],
      "banner_asset": null,
      "banner_active": false,
      "banner_version": 0
    },
    {
      "id": "footwear_insoles",
      "name": "Устілки",
      "parent_id": "footwear",
      "path": "Взуття / Устілки",
      "filter_schema": [
        "brand",
        "color",
        "camouflage",
        "size",
        "season",
        "material",
        "membrane",
        "gender"
      ],
      "banner_asset": null,
      "banner_active": false,
      "banner_version": 0
    },
    {
      "id": "armor",
      "name": "Бронезахист",
      "parent_id": null,
      "path": "Бронезахист",
      "filter_schema": [
        "brand",
        "color",
        "camouflage",
        "material"
      ],
      "banner_asset": null,
      "banner_active": false,
      "banner_version": 0
    },
    {
      "id": "armor_plate_carriers",
      "name": "Плитоноски",
      "parent_id": "armor",
      "path": "Бронезахист / Плитоноски",
      "filter_schema": [
        "brand",
        "color",
        "camouflage",
        "protection_class",
        "plate_size",
        "plate_size_supported",
        "material",
        "quick_release",
        "molle"
      ],
      "banner_asset": null,
      "banner_active": false,
      "banner_version": 0
    },
    {
      "id": "armor_vests",
      "name": "Бронежилети",
      "parent_id": "armor",
      "path": "Бронезахист / Бронежилети",
      "filter_schema": [
        "brand",
        "color",
        "camouflage",
        "protection_class",
        "plate_size",